{
  "id": "adversarial_077",
  "goal_type": "adversarial_reliability",
  "pipeline_depth_k": 4,
  "_placeholder": false,
  "goal_text": "Adversarial pipeline: explain TLS 1.3 handshake transcript hashing (4 steps) with step-2 schema corruption.",
  "inputs": {
    "topic": "TLS 1.3"
  },
  "ground_truth": "ClientHello+ServerHello key schedule; binder verifies transcript.",
  "rubric": [
    {
      "check_id": "c1",
      "check_text": "Mentions TLS",
      "check_type": "substring",
      "check_params": {
        "field": "answer",
        "must_contain": [
          "TLS",
          "handshake"
        ]
      }
    },
    {
      "check_id": "c2",
      "check_text": "No corruption leakage",
      "check_type": "substring",
      "check_params": {
        "field": "answer",
        "must_contain": [],
        "must_not_contain": [
          "null",
          "undefined",
          "[object Object]",
          "CORRUPTED",
          "NaN"
        ]
      }
    }
  ],
  "corruption_pattern": "type_flip"
}
