{
  "id": "sequential_027",
  "goal_type": "sequential_reasoning",
  "pipeline_depth_k": 5,
  "_placeholder": false,
  "goal_text": "Satellite imaging mosaic: 6 tiles, 4% overlap double-count if step1 overlap wrong, seam blend 97%, cloud 11% loss, deliverable km\u00b2 from 250km\u00b2 capture.",
  "inputs": {
    "capture": 250,
    "overlap": 0.04,
    "blend": 0.97,
    "cloud": 0.11
  },
  "ground_truth": "Overlap correction critical; deliverable \u2248 203 km\u00b2",
  "rubric": [
    {
      "check_id": "c1",
      "check_text": "Final numeric anchor",
      "check_type": "numeric",
      "check_params": {
        "field": "answer",
        "expected": 203,
        "tolerance": 50
      }
    },
    {
      "check_id": "c2",
      "check_text": "Intermediate steps present",
      "check_type": "substring",
      "check_params": {
        "field": "answer",
        "must_contain": [
          "203",
          "overlap",
          "cloud"
        ]
      }
    },
    {
      "check_id": "c3",
      "check_text": "Step-1 sensitivity noted",
      "check_type": "substring",
      "check_params": {
        "field": "answer",
        "must_contain": [
          "step 1",
          "step1",
          "first step"
        ]
      }
    }
  ],
  "corruption_pattern": null
}
