{
  "id": "adversarial_036",
  "goal_type": "adversarial_reliability",
  "pipeline_depth_k": 4,
  "_placeholder": false,
  "goal_text": "(Adversarial pipeline) Trace monetary policy transmission from a rate hike through yield curve, bank lending, exchange rates, to inflation with lag. Name friction and indicator at each step.",
  "inputs": {
    "topic": "monetary transmission"
  },
  "ground_truth": "Policy rate to yields; bank lending survey; FX import channel; inflation lag via core PCE and expectations.",
  "rubric": [
    {
      "check_id": "c1",
      "check_text": "Mentions yield curve or bank lending",
      "check_type": "substring",
      "check_params": {
        "field": "answer",
        "must_contain": [
          "yield curve",
          "bank lending",
          "inflation"
        ]
      }
    },
    {
      "check_id": "c2",
      "check_text": "No corruption markers",
      "check_type": "substring",
      "check_params": {
        "field": "answer",
        "must_contain": [],
        "must_not_contain": [
          "null",
          "undefined",
          "CORRUPTED"
        ]
      }
    },
    {
      "check_id": "c3",
      "check_text": "Valid transmission trace",
      "check_type": "semantic_judge",
      "check_params": {
        "field": "answer",
        "criteria": "Is the monetary transmission chain coherent after step-2 corruption without visible corruption strings?"
      }
    }
  ],
  "corruption_pattern": "drop_required_field"
}
