{
  "id": "adversarial_002",
  "goal_type": "adversarial_reliability",
  "pipeline_depth_k": 4,
  "_placeholder": false,
  "goal_text": "(Adversarial pipeline) Compare three explanations for the 2008 financial crisis: subprime securitization, global savings glut, and shadow banking. For each, state transmission channel, one empirical fact, and one criticism.",
  "inputs": {
    "topic": "2008 financial crisis"
  },
  "ground_truth": "Subprime MBS chain; savings glut and current accounts; repo and shadow banks; each narrative has documented facts and critiques.",
  "rubric": [
    {
      "check_id": "c1",
      "check_text": "Mentions subprime or shadow banking",
      "check_type": "substring",
      "check_params": {
        "field": "answer",
        "must_contain": [
          "subprime",
          "shadow banking",
          "savings glut"
        ]
      }
    },
    {
      "check_id": "c2",
      "check_text": "No corruption markers",
      "check_type": "substring",
      "check_params": {
        "field": "answer",
        "must_contain": [],
        "must_not_contain": [
          "null",
          "undefined",
          "CORRUPTED"
        ]
      }
    },
    {
      "check_id": "c3",
      "check_text": "Coherent post-corruption answer",
      "check_type": "semantic_judge",
      "check_params": {
        "field": "answer",
        "criteria": "Is the answer structurally valid after step-2 corruption, addressing the 2008 crisis narratives without nonsense?"
      }
    }
  ],
  "corruption_pattern": "type_flip"
}
