{
  "id": "adversarial_009",
  "goal_type": "adversarial_reliability",
  "pipeline_depth_k": 3,
  "_placeholder": false,
  "goal_text": "(Reused from sequential_007) A train leaves Station A at 8:00 AM heading toward Station B (200 miles away) at 60 mph. A second train leaves Station B at 8:30 AM heading toward Station A at 75 mph. At what clock time and at what distance from Station A do the trains meet?",
  "inputs": {
    "distance_miles": 200,
    "train1_speed_mph": 60,
    "train2_speed_mph": 75,
    "train1_departure": "8:00 AM",
    "train2_departure": "8:30 AM"
  },
  "ground_truth": "At 8:30 AM, Train 1 has traveled 30 miles (head start). Remaining distance: 170 miles. Combined closing speed: 135 mph. Time to close: 170/135 = 1.259 hours = 75.5 minutes. Meeting time: 8:30 + 1:15.5 = 9:45-9:46 AM. Distance from A: 30 + 60*1.259 = 105.5 miles.",
  "rubric": [
    {
      "check_id": "c1",
      "check_text": "Answer contains key term from base goal (train)",
      "check_type": "substring",
      "check_params": {
        "field": "answer",
        "must_contain": [
          "train",
          "Station",
          "mph"
        ]
      }
    },
    {
      "check_id": "c2",
      "check_text": "No corruption markers leaked into final answer",
      "check_type": "substring",
      "check_params": {
        "field": "answer",
        "must_contain": [],
        "must_not_contain": [
          "null",
          "undefined",
          "[object Object]",
          "NaN",
          "syntax error",
          "CORRUPTED"
        ]
      }
    }
  ],
  "corruption_pattern": "malformed_json"
}
