{
  "id": "sequential_007",
  "goal_type": "sequential_reasoning",
  "pipeline_depth_k": 3,
  "_placeholder": false,
  "goal_text": "A train leaves Station A at 8:00 AM heading toward Station B (200 miles away) at 60 mph. A second train leaves Station B at 8:30 AM heading toward Station A at 75 mph. At what clock time and at what distance from Station A do the trains meet?",
  "inputs": {
    "distance_miles": 200,
    "train1_speed_mph": 60,
    "train2_speed_mph": 75,
    "train1_departure": "8:00 AM",
    "train2_departure": "8:30 AM"
  },
  "ground_truth": "At 8:30 AM, Train 1 has traveled 30 miles (head start). Remaining distance: 170 miles. Combined closing speed: 135 mph. Time to close: 170/135 = 1.259 hours = 75.5 minutes. Meeting time: 8:30 + 1:15.5 = 9:45-9:46 AM. Distance from A: 30 + 60*1.259 = 105.5 miles.",
  "rubric": [
    {
      "check_id": "c1",
      "check_text": "Meeting time near 9:45-9:46 AM",
      "check_type": "substring",
      "check_params": {
        "field": "answer",
        "must_contain": [
          "9:45",
          "9:46",
          "9:44"
        ]
      }
    },
    {
      "check_id": "c2",
      "check_text": "Distance from A near 105 miles",
      "check_type": "numeric",
      "check_params": {
        "field": "answer",
        "expected": 105.5,
        "tolerance": 3
      }
    },
    {
      "check_id": "c3",
      "check_text": "Mentions 30-mile head start",
      "check_type": "substring",
      "check_params": {
        "field": "answer",
        "must_contain": [
          "30 mile",
          "head start",
          "head-start"
        ]
      }
    }
  ],
  "corruption_pattern": null
}
