{
  "id": "code_006",
  "goal_type": "code_analysis",
  "pipeline_depth_k": 4,
  "_placeholder": false,
  "goal_text": "Find the off-by-one in this JavaScript pagination helper. Identify the loop boundary error, give an input where the last page is skipped, show the corrected loop bound, and add a one-line assertion that would catch the bug.",
  "inputs": {
    "code": "function pageIndices(total, pageSize) {\n  const pages = Math.ceil(total / pageSize);\n  const starts = [];\n  for (let i = 0; i < pages - 1; i++) {\n    starts.push(i * pageSize);\n  }\n  return starts;\n}",
    "language": "javascript"
  },
  "ground_truth": "Loop i < pages-1 omits last page; total=25 pageSize=10 pages=3 misses index 20; fix i < pages; assert starts.length === pages",
  "rubric": [
    {
      "check_id": "c1",
      "check_text": "Identifies pages-1 off-by-one",
      "check_type": "substring",
      "check_params": {
        "field": "answer",
        "must_contain": [
          "pages - 1",
          "off-by-one",
          "last page"
        ]
      }
    },
    {
      "check_id": "c2",
      "check_text": "Fix uses i < pages",
      "check_type": "substring",
      "check_params": {
        "field": "answer",
        "must_contain": [
          "i < pages",
          "pages"
        ]
      }
    }
  ],
  "corruption_pattern": null
}
