{
  "id": "adversarial_089",
  "goal_type": "adversarial_reliability",
  "pipeline_depth_k": 4,
  "_placeholder": false,
  "goal_text": "Explain Bloom filter optimal k given m,n (4 steps); out-of-range corruption.",
  "inputs": {
    "m": 10000,
    "n": 1000
  },
  "ground_truth": "k = (m/n)*ln2.",
  "rubric": [
    {
      "check_id": "c1",
      "check_text": "Mentions Bloom",
      "check_type": "substring",
      "check_params": {
        "field": "answer",
        "must_contain": [
          "Bloom",
          "filter"
        ]
      }
    },
    {
      "check_id": "c2",
      "check_text": "No corruption leakage",
      "check_type": "substring",
      "check_params": {
        "field": "answer",
        "must_contain": [],
        "must_not_contain": [
          "null",
          "undefined",
          "[object Object]",
          "CORRUPTED",
          "NaN"
        ]
      }
    }
  ],
  "corruption_pattern": "malformed_json"
}
