{
  "id": "sequential_021",
  "goal_type": "sequential_reasoning",
  "pipeline_depth_k": 5,
  "_placeholder": false,
  "goal_text": "Currency arb path: USD\u2192EUR 0.92 fee 0.5%, EUR\u2192GBP 0.86 fee 0.5%, GBP\u2192USD 1.28 fee 0.5%, $10000 round-trip?",
  "inputs": {
    "usd": 10000
  },
  "ground_truth": "Product fees; if step1 EUR wrong, final USD not 9850",
  "rubric": [
    {
      "check_id": "c1",
      "check_text": "Final numeric anchor",
      "check_type": "numeric",
      "check_params": {
        "field": "answer",
        "expected": 9850,
        "tolerance": 492.5
      }
    },
    {
      "check_id": "c2",
      "check_text": "Intermediate steps present",
      "check_type": "substring",
      "check_params": {
        "field": "answer",
        "must_contain": [
          "fee",
          "round-trip",
          "9850"
        ]
      }
    },
    {
      "check_id": "c3",
      "check_text": "Step-1 sensitivity noted",
      "check_type": "substring",
      "check_params": {
        "field": "answer",
        "must_contain": [
          "step 1",
          "step1",
          "first step"
        ]
      }
    }
  ],
  "corruption_pattern": null
}
