{
  "id": "adversarial_012",
  "goal_type": "adversarial_reliability",
  "pipeline_depth_k": 3,
  "_placeholder": false,
  "goal_text": "(Reused from sequential_011) Alice, Bob, Carol are suspects. Exactly one committed the crime. Each makes exactly one statement: Alice says 'Bob is guilty.', Bob says 'I am innocent.', Carol says 'Alice is innocent.' Exactly one of the three statements is true. Who committed the crime? Show your full reasoning.",
  "inputs": {
    "statement_alice": "Bob is guilty.",
    "statement_bob": "I am innocent.",
    "statement_carol": "Alice is innocent.",
    "constraint": "Exactly one statement is true."
  },
  "ground_truth": "If Alice guilty: Alice stmt=FALSE; Bob stmt=TRUE (he is innocent); Carol stmt=FALSE. Exactly 1 true. \u2713 If Bob guilty: Alice=TRUE; Bob=FALSE; Carol=TRUE. 2 true. \u2717 If Carol guilty: Alice=FALSE; Bob=TRUE; Carol=TRUE. 2 true. \u2717 Answer: Alice committed the crime.",
  "rubric": [
    {
      "check_id": "c1",
      "check_text": "Answer contains key term from base goal (Alice)",
      "check_type": "substring",
      "check_params": {
        "field": "answer",
        "must_contain": [
          "Alice",
          "Bob",
          "Carol",
          "guilty"
        ]
      }
    },
    {
      "check_id": "c2",
      "check_text": "No corruption markers leaked into final answer",
      "check_type": "substring",
      "check_params": {
        "field": "answer",
        "must_contain": [],
        "must_not_contain": [
          "null",
          "undefined",
          "[object Object]",
          "NaN",
          "syntax error",
          "CORRUPTED"
        ]
      }
    },
    {
      "check_id": "c3",
      "check_text": "Final answer reflects valid recovery from step-2 corruption",
      "check_type": "semantic_judge",
      "check_params": {
        "field": "answer",
        "criteria": "Given that step 2 of the pipeline received corrupted input, does the final answer still reflect a structurally valid and coherent response to the original goal, rather than propagating the corruption as visible text or producing nonsense?"
      }
    }
  ],
  "corruption_pattern": "type_flip"
}
