{
  "id": "code_012",
  "goal_type": "code_analysis",
  "pipeline_depth_k": 3,
  "_placeholder": false,
  "goal_text": "Find the bug in this Rust function that normalizes temperature using u8 arithmetic. Identify the line number, bug category, and propose the exact fix.",
  "inputs": {
    "code": "fn celsius_to_score(temp: u8) -> u8 {\n    let normalized = (temp - 32) * 100 / 68;\n    normalized\n}\n\nfn main() {\n    println!(\"{}\", celsius_to_score(20));\n}",
    "language": "rust"
  },
  "ground_truth": "Bug at line 2: '(temp - 32)' when temp is u8 and temp < 32 causes integer underflow. u8 cannot represent negative values; in debug mode Rust panics with 'attempt to subtract with overflow'. For temp=20: 20-32 would wrap to 244 in release mode or panic in debug mode. Category: type error (integer underflow on unsigned type). Fix: use i32 instead of u8, or add a bounds check before subtraction.",
  "rubric": [
    {
      "check_id": "c1",
      "check_text": "Identifies line 2 as the bug",
      "check_type": "substring",
      "check_params": {
        "field": "answer",
        "must_contain": [
          "line 2",
          "temp - 32",
          "(temp - 32)"
        ]
      }
    },
    {
      "check_id": "c2",
      "check_text": "Categorizes as type error or integer underflow",
      "check_type": "substring",
      "check_params": {
        "field": "answer",
        "must_contain": [
          "type error",
          "underflow",
          "overflow",
          "unsigned",
          "u8"
        ]
      }
    },
    {
      "check_id": "c3",
      "check_text": "Proposes using signed type or bounds check",
      "check_type": "substring",
      "check_params": {
        "field": "answer",
        "must_contain": [
          "i32",
          "i16",
          "signed",
          "bounds check",
          "negative"
        ]
      }
    }
  ],
  "corruption_pattern": null
}
