{
  "id": "adversarial_083",
  "goal_type": "adversarial_reliability",
  "pipeline_depth_k": 4,
  "_placeholder": false,
  "goal_text": "Quantize neural net layer: scale, zero-point, dequant, accuracy delta\u2014out-of-range corruption step 2.",
  "inputs": {},
  "ground_truth": "Scale = (max-min)/255.",
  "rubric": [
    {
      "check_id": "c1",
      "check_text": "Mentions quantiz",
      "check_type": "substring",
      "check_params": {
        "field": "answer",
        "must_contain": [
          "quantiz",
          "scale"
        ]
      }
    },
    {
      "check_id": "c2",
      "check_text": "No corruption leakage",
      "check_type": "substring",
      "check_params": {
        "field": "answer",
        "must_contain": [],
        "must_not_contain": [
          "null",
          "undefined",
          "[object Object]",
          "CORRUPTED",
          "NaN"
        ]
      }
    }
  ],
  "corruption_pattern": "out_of_range"
}
