{
  "id": "sequential_025",
  "goal_type": "sequential_reasoning",
  "pipeline_depth_k": 5,
  "_placeholder": false,
  "goal_text": " Tournament Elo: 8 players, upset round1 changes seed 72%\u219255% path, propagate 3 rounds, final leader rating delta +120 from 1500 base.",
  "inputs": {
    "base": 1500,
    "delta": 120
  },
  "ground_truth": "Round1 upset poisons round4 rating; leader \u2248 1620",
  "rubric": [
    {
      "check_id": "c1",
      "check_text": "Final numeric anchor",
      "check_type": "numeric",
      "check_params": {
        "field": "answer",
        "expected": 1620,
        "tolerance": 81.0
      }
    },
    {
      "check_id": "c2",
      "check_text": "Intermediate steps present",
      "check_type": "substring",
      "check_params": {
        "field": "answer",
        "must_contain": [
          "1620",
          "Elo",
          "upset"
        ]
      }
    },
    {
      "check_id": "c3",
      "check_text": "Step-1 sensitivity noted",
      "check_type": "substring",
      "check_params": {
        "field": "answer",
        "must_contain": [
          "step 1",
          "step1",
          "first step"
        ]
      }
    }
  ],
  "corruption_pattern": null
}
